author,theme,keywords
Han Kang,historical_trauma,"trauma, massacre, testimony, mourning, memory, grief, body, witness, history, Gwangju, Jeju"
Han Kang,care_silence,"care, tenderness, white, silence, hush, breath, milk, gauze, snow, absence, fragile"
Han Kang,language_voice,"language, voice, aphasia, learn, Greek, listen, speak, word, letter"
László Krasznahorkai,apocalypse_entropy,"apocalypse, terror, collapse, disorder, ruin, crowd, mob, rumor, endless, decay, filth"
László Krasznahorkai,endurance_form,"endure, incessant, sentence, long, breath, waiting, resistance, insistence"
László Krasznahorkai,space_border,"border, village, road, return, drift, East, West, Berlin, Budapest"
